{
  "artifacts": [
    {
      "artifact_id": "sha256:623532320a9e93d207ac4b5a65fc9de63fcbabb1e58cdba6d552f3bea8c49e93",
      "license_expression": "Apache-2.0",
      "media_type": "application/yaml",
      "path": "ORIGIN.yml",
      "release_status": "source_released",
      "sha256": "623532320a9e93d207ac4b5a65fc9de63fcbabb1e58cdba6d552f3bea8c49e93"
    },
    {
      "artifact_id": "sha256:05b05f29bb8dd334e7a004655dbcd9e66be2ef4a4c357ceb3aa74674773f909a",
      "license_expression": "Apache-2.0",
      "media_type": "application/json",
      "path": "metadata.json",
      "release_status": "source_released",
      "sha256": "05b05f29bb8dd334e7a004655dbcd9e66be2ef4a4c357ceb3aa74674773f909a"
    },
    {
      "artifact_id": "sha256:d1112b860f956dc0b97bda4b024ae2f8943814dde03af6d47e27d9da9d3abacd",
      "license_expression": "Apache-2.0",
      "media_type": "text/x-systemverilog",
      "path": "rtl/cdc_handshake.sv",
      "release_status": "source_released",
      "sha256": "d1112b860f956dc0b97bda4b024ae2f8943814dde03af6d47e27d9da9d3abacd"
    },
    {
      "artifact_id": "sha256:86914394abcc942f66ba00376e3bf5c54bee88d36074c187d8cec6609f8812f6",
      "license_expression": "Apache-2.0",
      "media_type": "application/octet-stream",
      "path": "scripts/run.sh",
      "release_status": "source_released",
      "sha256": "86914394abcc942f66ba00376e3bf5c54bee88d36074c187d8cec6609f8812f6"
    },
    {
      "artifact_id": "sha256:7058becbe4438ec12d50189f86b65798f65b2b086db8007a7cceeabf2d07e553",
      "license_expression": "Apache-2.0",
      "media_type": "application/json",
      "path": "tasks/fault_localization_repair/0000.json",
      "release_status": "source_released",
      "sha256": "7058becbe4438ec12d50189f86b65798f65b2b086db8007a7cceeabf2d07e553"
    },
    {
      "artifact_id": "sha256:e5f3ec720be06af81a47e5208535ebdbcd7df08cde86ba2bc692b4eabb15112d",
      "license_expression": "Apache-2.0",
      "media_type": "application/json",
      "path": "tasks/functional_timing_understanding/0000.json",
      "release_status": "source_released",
      "sha256": "e5f3ec720be06af81a47e5208535ebdbcd7df08cde86ba2bc692b4eabb15112d"
    },
    {
      "artifact_id": "sha256:18b0a3db00bff8e92c8d61478b0cf45606c3e3ce03d9c0b12caefcca2846a7b3",
      "license_expression": "Apache-2.0",
      "media_type": "application/json",
      "path": "tasks/hierarchical_rtl_generation/0000.json",
      "release_status": "source_released",
      "sha256": "18b0a3db00bff8e92c8d61478b0cf45606c3e3ce03d9c0b12caefcca2846a7b3"
    },
    {
      "artifact_id": "sha256:123bc27fefdec062493a50e6fdb3f58daa714d8a94d24f6f1849fe64b1a6ffa1",
      "license_expression": "Apache-2.0",
      "media_type": "application/json",
      "path": "tasks/hierarchy_dependency_analysis/0000.json",
      "release_status": "source_released",
      "sha256": "123bc27fefdec062493a50e6fdb3f58daa714d8a94d24f6f1849fe64b1a6ffa1"
    },
    {
      "artifact_id": "sha256:3bc2e89282fe6ddbe98fcccd0f57ac06b4ee9f29cb1b5c1f9c24f4da108a50c2",
      "license_expression": "Apache-2.0",
      "media_type": "application/json",
      "path": "tasks/reuse_integration/0000.json",
      "release_status": "source_released",
      "sha256": "3bc2e89282fe6ddbe98fcccd0f57ac06b4ee9f29cb1b5c1f9c24f4da108a50c2"
    },
    {
      "artifact_id": "sha256:1e3380b4176a6a99c3a1f9000d8763a7e9b5e7bc7adedb5169c605ff5b02d8bf",
      "license_expression": "Apache-2.0",
      "media_type": "application/json",
      "path": "tasks/tool_result_analysis/0000.json",
      "release_status": "source_released",
      "sha256": "1e3380b4176a6a99c3a1f9000d8763a7e9b5e7bc7adedb5169c605ff5b02d8bf"
    },
    {
      "artifact_id": "sha256:975d91004d65a6a06cbc80afc658cc42cd4d9d0f84b041df5a93b7d810805646",
      "license_expression": "Apache-2.0",
      "media_type": "application/json",
      "path": "tasks/verification_generation/0000.json",
      "release_status": "source_released",
      "sha256": "975d91004d65a6a06cbc80afc658cc42cd4d9d0f84b041df5a93b7d810805646"
    },
    {
      "artifact_id": "sha256:a2e580cd120bc21b654cdfefa9424180aed077d8ef8f321d4ada788bdf966261",
      "license_expression": "Apache-2.0",
      "media_type": "text/x-systemverilog",
      "path": "tb/tb_cdc_handshake.sv",
      "release_status": "source_released",
      "sha256": "a2e580cd120bc21b654cdfefa9424180aed077d8ef8f321d4ada788bdf966261"
    },
    {
      "artifact_id": "sha256:46e7da0884cb59c7e9a524c12d5bcabf31d61eb339ed19dd3d7c75ca294e3319",
      "license_expression": "Apache-2.0",
      "media_type": "application/json",
      "path": "validation/result.json",
      "release_status": "source_released",
      "sha256": "46e7da0884cb59c7e9a524c12d5bcabf31d61eb339ed19dd3d7c75ca294e3319"
    }
  ],
  "edges": [
    {
      "evidence_refs": [
        "sha256:d1112b860f956dc0b97bda4b024ae2f8943814dde03af6d47e27d9da9d3abacd"
      ],
      "id": "edge:cdc_handshake-clock-dst_clk_i",
      "source": "module:cdc_handshake",
      "target": "clock_domain:dst_clk_i",
      "type": "clocked_by"
    },
    {
      "evidence_refs": [
        "sha256:d1112b860f956dc0b97bda4b024ae2f8943814dde03af6d47e27d9da9d3abacd"
      ],
      "id": "edge:cdc_handshake-clock-src_clk_i",
      "source": "module:cdc_handshake",
      "target": "clock_domain:src_clk_i",
      "type": "clocked_by"
    },
    {
      "evidence_refs": [
        "sha256:d1112b860f956dc0b97bda4b024ae2f8943814dde03af6d47e27d9da9d3abacd"
      ],
      "id": "edge:cdc_handshake-parameter-Width",
      "source": "module:cdc_handshake",
      "target": "parameter:cdc_handshake.Width",
      "type": "contains"
    },
    {
      "evidence_refs": [
        "sha256:d1112b860f956dc0b97bda4b024ae2f8943814dde03af6d47e27d9da9d3abacd"
      ],
      "id": "edge:cdc_handshake-port-dst_clk_i",
      "source": "module:cdc_handshake",
      "target": "port:cdc_handshake.dst_clk_i",
      "type": "contains"
    },
    {
      "evidence_refs": [
        "sha256:d1112b860f956dc0b97bda4b024ae2f8943814dde03af6d47e27d9da9d3abacd"
      ],
      "id": "edge:cdc_handshake-port-dst_data_o",
      "source": "module:cdc_handshake",
      "target": "port:cdc_handshake.dst_data_o",
      "type": "contains"
    },
    {
      "evidence_refs": [
        "sha256:d1112b860f956dc0b97bda4b024ae2f8943814dde03af6d47e27d9da9d3abacd"
      ],
      "id": "edge:cdc_handshake-port-dst_ready_i",
      "source": "module:cdc_handshake",
      "target": "port:cdc_handshake.dst_ready_i",
      "type": "contains"
    },
    {
      "evidence_refs": [
        "sha256:d1112b860f956dc0b97bda4b024ae2f8943814dde03af6d47e27d9da9d3abacd"
      ],
      "id": "edge:cdc_handshake-port-dst_rst_ni",
      "source": "module:cdc_handshake",
      "target": "port:cdc_handshake.dst_rst_ni",
      "type": "contains"
    },
    {
      "evidence_refs": [
        "sha256:d1112b860f956dc0b97bda4b024ae2f8943814dde03af6d47e27d9da9d3abacd"
      ],
      "id": "edge:cdc_handshake-port-dst_valid_o",
      "source": "module:cdc_handshake",
      "target": "port:cdc_handshake.dst_valid_o",
      "type": "contains"
    },
    {
      "evidence_refs": [
        "sha256:d1112b860f956dc0b97bda4b024ae2f8943814dde03af6d47e27d9da9d3abacd"
      ],
      "id": "edge:cdc_handshake-port-src_clk_i",
      "source": "module:cdc_handshake",
      "target": "port:cdc_handshake.src_clk_i",
      "type": "contains"
    },
    {
      "evidence_refs": [
        "sha256:d1112b860f956dc0b97bda4b024ae2f8943814dde03af6d47e27d9da9d3abacd"
      ],
      "id": "edge:cdc_handshake-port-src_data_i",
      "source": "module:cdc_handshake",
      "target": "port:cdc_handshake.src_data_i",
      "type": "contains"
    },
    {
      "evidence_refs": [
        "sha256:d1112b860f956dc0b97bda4b024ae2f8943814dde03af6d47e27d9da9d3abacd"
      ],
      "id": "edge:cdc_handshake-port-src_ready_o",
      "source": "module:cdc_handshake",
      "target": "port:cdc_handshake.src_ready_o",
      "type": "contains"
    },
    {
      "evidence_refs": [
        "sha256:d1112b860f956dc0b97bda4b024ae2f8943814dde03af6d47e27d9da9d3abacd"
      ],
      "id": "edge:cdc_handshake-port-src_rst_ni",
      "source": "module:cdc_handshake",
      "target": "port:cdc_handshake.src_rst_ni",
      "type": "contains"
    },
    {
      "evidence_refs": [
        "sha256:d1112b860f956dc0b97bda4b024ae2f8943814dde03af6d47e27d9da9d3abacd"
      ],
      "id": "edge:cdc_handshake-port-src_valid_i",
      "source": "module:cdc_handshake",
      "target": "port:cdc_handshake.src_valid_i",
      "type": "contains"
    },
    {
      "evidence_refs": [
        "sha256:d1112b860f956dc0b97bda4b024ae2f8943814dde03af6d47e27d9da9d3abacd"
      ],
      "id": "edge:cdc_handshake-reset-dst_rst_ni",
      "source": "module:cdc_handshake",
      "target": "reset_domain:dst_rst_ni",
      "type": "reset_by"
    },
    {
      "evidence_refs": [
        "sha256:d1112b860f956dc0b97bda4b024ae2f8943814dde03af6d47e27d9da9d3abacd"
      ],
      "id": "edge:cdc_handshake-reset-src_rst_ni",
      "source": "module:cdc_handshake",
      "target": "reset_domain:src_rst_ni",
      "type": "reset_by"
    },
    {
      "evidence_refs": [
        "sha256:d1112b860f956dc0b97bda4b024ae2f8943814dde03af6d47e27d9da9d3abacd"
      ],
      "id": "edge:project-contains-cdc_handshake",
      "source": "project:cdc_handshake",
      "target": "module:cdc_handshake",
      "type": "contains"
    },
    {
      "evidence_refs": [
        "sha256:623532320a9e93d207ac4b5a65fc9de63fcbabb1e58cdba6d552f3bea8c49e93"
      ],
      "id": "edge:project-license",
      "source": "project:cdc_handshake",
      "target": "license:Apache-2.0",
      "type": "constrained_by"
    },
    {
      "evidence_refs": [
        "sha256:05b05f29bb8dd334e7a004655dbcd9e66be2ef4a4c357ceb3aa74674773f909a"
      ],
      "id": "edge:project-obligation-000",
      "source": "project:cdc_handshake",
      "target": "verification_obligation:000",